{
  "visit_id": "visit_001",
  "visitor_id": "V20260620002",
  "visit_number": 1,
  "date": "2026-06-20",
  "visit_summary": {
    "complaint": "详见案例概要和咨询师复盘",
    "outcome": "建立咨访关系，完成初步评估",
    "homework": "记录情绪日记",
    "next_step": "下次继续深入探讨",
    "counselor": "咨询师A",
    "duration": 50,
    "risk_assessment": {
      "risk_level": "中",
      "risk_type": "待评估",
      "risk_factors": []
    },
    "symptom_change": "持平"
  },
  "case_data": {
    "case_id": "C20260620002",
    "case_summary": "女企业主确诊抑郁症+焦虑症，更年期叠加，已休息两个月，有轻生想法但无明确计划。主要压力来自账目收不回、时代变化快、不想学习。咨询师使用了'内在小孩'理论进行重新框架，强调动力枯竭是新课题，建议让理性满足内在小孩需求而非外界需求。咨询师有两处自我质疑：1）建议'去厂里看看'过于直接；2）建议'休息半年'担心经营风险。案主用'更年期'作为保护壳。危机等级M（中度），需持续跟进。",
    "case_tags": {
      "relation": [
        "工作关系-企业经营压力",
        "社会关系-经济困境"
      ],
      "symptom": [
        "情绪障碍-抑郁症（已确诊）",
        "情绪障碍-焦虑症（已确诊）",
        "躯体症状-抑郁躯体化（身体无法挪动）",
        "行为问题-自杀意念（想轻生）",
        "内分泌-更年期综合征"
      ]
    },
    "counselor_review": "压垮人的是，一直都这样\n2、抑郁的女老板                                                   15:17-16:03\n一上来就说自己更年期，被医院确诊了抑郁症和焦虑症，目前已经在家休息了两个月，有自己的厂子，目前由厂长在管着，觉得活着没有意思，有点想轻生。主要的现实压力是账目收不回来，时代变化太快，不想学习，不想当老板了，想当个平凡人。我表示共情并理解，这年头大环境不好，变化又快，的确当老板压力很大。目前长期服药，越想越害怕，想去厂里但是身体怎么挪也挪不动，这时我建议能不能就只是去厂外看看【我应该问你做过哪些努力呢，以探索代替给建议】，她回复说她做不到。一度抽泣了两分钟，我说这是身体躯体化了，她表示赞同。\n这时候我开始上场，我说这是你的内在小孩，心累了已经无法支持你了。你以前的模式是对自己总是应该这应该那得，用理性去应对客户，去应对员工，内在小孩会受很多委屈，但是也取得了很多成就，现在你的内在小孩罢工了，她受了很多伤害，现在任凭理性如何使唤都已经无法让她获得动力了。所以她的动力源枯竭了，这也是你面对的新的课题，如何让她获得动力再次站起来，这个比你的工厂，比你的客户的优先级都重要，一旦解决了，你可以在你六十，八十生命都能获得丰盈。我们要改变模式，以前的理性总是去满足外人的需求委屈自己，现在我们反过来，让理性满足内在小孩的需求，让理性去想办法，比如我们休息这两个月，如果不去工厂就不去了，那如何能干点让内在小孩的开心的事儿，实在不知道去哪，你可以把中国的城市清单打开，闭着眼睛划，划到哪个去哪个，让理性去想办法去满足内在小孩，也可以换个发型，染个红发之类的，都可以。然后我们在内在小孩开心的时候，然后批准理性如何有效的干预工厂【让她干预工厂感觉有点欠妥】。\n她觉得自己是个懒人，工人还等着她吃饭，客户还等着她去维护，我又说，你担心的不是你因抑郁症休息了两个月，而是一直这样，怕自己一直这样。我说你可以这么想，老娘努力了二十多年，从零开始打拼到现在，休息两个月怎么了，然后赦免了自己休息两个月的耻辱感，然后你的今天是从零开始的，很多人只能做一方面工作，比如市场人员只会做市场，销售人员只会销售，你一路走来，你的能力很优秀，所以你的能力很棒，要对自己的能力有信心，即使你再休息半年之类，你要相信自己能处理的。【这个建议会不会很冒险，万一经营有事了，会不会连累到我】\n最后挂电话前，她又说，这个是不是更年期的影响。我瞬间知道更年期是她的保护壳，我回复说，更年期各种激素有变化，会有影响的。\n最大的感受是所有精神病人不是担心过去的日子，而是担心自己一直这么下去，以一种泛化或者灾难化的思维来考虑问题。",
    "recordings": [],
    "transcript": [],
    "approach_analyses": {
      "daguanpai": {
        "conceptualization": "女企业主确诊抑郁症+焦虑症，更年期叠加，已休息两个月，有轻生想法但无明确计划。主要压力来自账目收不回、时代变化快、不想学习。咨询师使用了'内在小孩'理论进行重新框架，强调动力枯竭是新课题，建议让理性满足内在小孩需求而非外界需求。咨询师有两处自我质疑：1）建议'去厂里看看'过于直接；2）建议'休息半年'担心经营风险。案主用'更年期'作为保护壳。危机等级M（中度），需持续跟进。",
        "intervention_suggestions": "评估自杀风险，建立安全计划（轻生想法的频率、强度、是否有计划）\n与精神科医生沟通，评估药物治疗效果和更年期激素治疗的可能性\n探索'一直这样'的灾难化思维，使用CBT技术进行认知重构\n探索案主的核心信念：'我必须坚强'、'我不能休息'、'工人靠我吃饭'\n评估实际经营状况和支持系统（厂长能力、财务状况），帮助案主做现实评估而非灾难化\n如果案主准备好，可以探索'理性满足外界 vs 满足内在小孩'的模式转换练习",
        "key_points": [
          "很好地识别了躯体化症状（'身体无法挪动'），并得到案主认同",
          "'内在小孩'隐喻使用有创意，帮助案主理解动力枯竭的深层原因",
          "成功重新框架：从'应该去工厂'转向'如何让内在小孩开心'",
          "赋能技术使用得当（'老娘努力了二十多年，休息两个月怎么了'），减轻耻辱感",
          "识别了案主的灾难化思维（'一直这样'），并进行澄清",
          "敏锐捕捉到'更年期'是案主的心理防御机制",
          "咨询师自评准确：建议'去厂外看看'过于直接，应该先问'你做过哪些努力'来探索",
          "建议'休息半年'可能风险较高，咨询师的担心是合理的（'万一经营有事了，会不会连累到我'），建议改为探索式提问而非给建议",
          "对'想轻生'的评估不够深入，未建立安全计划或评估自杀风险程度",
          "对更年期的回应过于简短（'会有影响的'），可以更深入探讨更年期与抑郁症的交互作用",
          "案主提到'工人还等着她吃饭'显示责任感压力，但未充分探索这背后的信念系统",
          "内在小孩理论讲解较长（说教），可能让案主被动接受而非主动觉察",
          "未与案主讨论精神科治疗配合（'长期服药'但效果如何？药物调整？）"
        ]
      }
    },
    "supervision_records": []
  },
  "metadata": {
    "created_at": "2026-06-28T23:19:20.196694",
    "updated_at": "2026-06-29T00:29:42.454701"
  }
}